{
  "receipt_version": "0.2",
  "receipt_id": "01a0a4f0-3200-7001-8000-000000000000",
  "timestamp": "2026-09-15T12:00:00.000Z",
  "time_source": "trusted",
  "actor": {
    "agent_id": "fixture-agent",
    "session_id": "fixture-session",
    "principal": "fixture@hushspec.dev",
    "runtime": "hushspec-conformance/0.2"
  },
  "policy": {
    "spec_version": "0.1.0",
    "content_hash": "sha256:73e0b830c3588624255a34751372ecc5ce86374d9905610a0a500bf535becd38"
  },
  "action": {
    "type": "egress",
    "target": "api.anthropic.com"
  },
  "decision": "allow",
  "matched_rule": "rules.egress.allow",
  "reason": "domain is explicitly allowed",
  "rule_trace": [
    {
      "rule_block": "egress",
      "rule_path": "rules.egress.allow",
      "outcome": "allow",
      "evaluated": true,
      "reason": "domain is explicitly allowed"
    },
    {
      "rule_block": "secret_patterns",
      "outcome": "skip",
      "evaluated": false,
      "reason": "no secret_patterns rule configured"
    }
  ],
  "enforcement": {
    "mode": "enforce",
    "outcome": "allowed"
  }
}
