{
  "receipt_version": "0.2",
  "receipt_id": "01a0a4f0-3200-7001-8000-000000000000",
  "timestamp": "2026-09-15T12:00:00.000Z",
  "time_source": "trusted",
  "actor": {
    "agent_id": "fixture-agent",
    "session_id": "fixture-session",
    "principal": "fixture@hushspec.dev",
    "runtime": "hushspec-conformance/0.2"
  },
  "policy": {
    "spec_version": "0.1.0",
    "content_hash": "sha256:7046443e68b1b810a0d573e291f184b5f273eb1f4782404818e89b1eeb16d8d7"
  },
  "action": {
    "type": "file_read",
    "target": "/home/user/.aws/credentials"
  },
  "decision": "deny",
  "matched_rule": "rules.forbidden_paths.patterns",
  "reason": "path matched a forbidden pattern",
  "rule_trace": [
    {
      "rule_block": "forbidden_paths",
      "rule_path": "rules.forbidden_paths.patterns",
      "outcome": "deny",
      "evaluated": true,
      "reason": "path matched a forbidden pattern"
    },
    {
      "rule_block": "path_allowlist",
      "outcome": "skip",
      "evaluated": false,
      "reason": "no path_allowlist rule configured"
    }
  ],
  "enforcement": {
    "mode": "enforce",
    "outcome": "blocked"
  }
}
