{
  "receipt_version": "0.2",
  "receipt_id": "01a0a4f0-3200-7000-8000-000000000000",
  "timestamp": "2026-09-15T12:00:00.000Z",
  "time_source": "trusted",
  "actor": {
    "agent_id": "fixture-agent",
    "session_id": "fixture-session",
    "principal": "fixture@hushspec.dev",
    "runtime": "hushspec-conformance/0.2"
  },
  "policy": {
    "spec_version": "0.1.0",
    "content_hash": "sha256:0d1c7b8c81c05147837df646d236fda577ae80d7980d3fb7b66492d56cda9837"
  },
  "action": {
    "type": "shell_command",
    "target": "rm -rf /tmp/x",
    "context": {
      "counters": {
        "shell_commands": 5
      }
    }
  },
  "decision": "deny",
  "matched_rule": "rules.shell_commands.forbidden_patterns[0]",
  "reason": "shell command matched a forbidden pattern",
  "rule_trace": [
    {
      "rule_block": "shell_commands",
      "rule_path": "rules.shell_commands.forbidden_patterns[0]",
      "outcome": "deny",
      "evaluated": true,
      "reason": "shell command matched a forbidden pattern"
    }
  ],
  "enforcement": {
    "mode": "enforce",
    "outcome": "blocked"
  }
}
