{
  "receipt_version": "0.2",
  "receipt_id": "01a0a4f0-3200-7003-8000-000000000000",
  "timestamp": "2026-09-15T12:00:00.000Z",
  "time_source": "trusted",
  "actor": {
    "agent_id": "fixture-agent",
    "session_id": "fixture-session",
    "principal": "fixture@hushspec.dev",
    "runtime": "hushspec-conformance/0.2"
  },
  "policy": {
    "spec_version": "0.1.0",
    "content_hash": "sha256:ef615e0204f884d06dae0ec5d6023681ffafe7bca42d0a9950631e9ff335103d"
  },
  "action": {
    "type": "egress",
    "target": "api.example.com",
    "context": {
      "environment": "staging"
    }
  },
  "decision": "deny",
  "matched_rule": "rules.egress.default",
  "reason": "domain matched default block",
  "rule_trace": [
    {
      "rule_block": "egress",
      "rule_path": "rules.egress.default",
      "outcome": "deny",
      "evaluated": true,
      "reason": "domain matched default block"
    },
    {
      "rule_block": "secret_patterns",
      "outcome": "skip",
      "evaluated": false,
      "reason": "no secret_patterns rule configured"
    }
  ],
  "enforcement": {
    "mode": "enforce",
    "outcome": "blocked"
  }
}
