{
  "receipt_version": "0.2",
  "receipt_id": "01a0a4f0-3200-7000-8000-000000000000",
  "timestamp": "2026-09-15T12:00:00.000Z",
  "time_source": "trusted",
  "actor": {
    "agent_id": "fixture-agent",
    "session_id": "fixture-session",
    "principal": "fixture@hushspec.dev",
    "runtime": "hushspec-conformance/0.2"
  },
  "policy": {
    "spec_version": "0.1.0",
    "content_hash": "sha256:6440d803ba6ffa706bc6b064395e69dfebe9fd086266b6d9ab76fc2180083f8b"
  },
  "action": {
    "type": "tool_call",
    "target": "chat",
    "content_hash": "sha256:8fd5f7ac3322ce34e03d3ed96af3905cef6569846779c92ec0d0f7d7ce252fc2",
    "content_size": 25
  },
  "decision": "allow",
  "matched_rule": "rules.tool_access.allow",
  "reason": "tool is explicitly allowed",
  "rule_trace": [
    {
      "rule_block": "tool_access",
      "rule_path": "rules.tool_access.allow",
      "outcome": "allow",
      "evaluated": true,
      "reason": "tool is explicitly allowed"
    },
    {
      "rule_block": "secret_patterns",
      "outcome": "skip",
      "evaluated": false,
      "reason": "no secret_patterns rule configured"
    }
  ],
  "detection_trace": [
    {
      "detector_id": "regex_jailbreak@1",
      "category": "jailbreak",
      "score": 0.0,
      "level": "none",
      "matched": false
    }
  ],
  "enforcement": {
    "mode": "enforce",
    "outcome": "allowed"
  }
}
