{
  "receipt_version": "0.2",
  "receipt_id": "01a0a4f0-3200-7000-8000-000000000000",
  "timestamp": "2026-09-15T12:00:00.000Z",
  "time_source": "trusted",
  "actor": {
    "agent_id": "fixture-agent",
    "session_id": "fixture-session",
    "principal": "fixture@hushspec.dev",
    "runtime": "hushspec-conformance/0.2"
  },
  "policy": {
    "spec_version": "0.1.0",
    "content_hash": "sha256:2cf060f92dc34678513dbe001640e6bbd070b66e9af816c5e108a607572e8296"
  },
  "action": {
    "type": "tool_call",
    "target": "chat",
    "content_hash": "sha256:640fe48f3f9783367da697dfaff9239e598c0de0cb21cae87313908c75db6f80",
    "content_size": 32
  },
  "decision": "allow",
  "matched_rule": "rules.tool_access.allow",
  "reason": "tool is explicitly allowed",
  "rule_trace": [
    {
      "rule_block": "tool_access",
      "rule_path": "rules.tool_access.allow",
      "outcome": "allow",
      "evaluated": true,
      "reason": "tool is explicitly allowed"
    },
    {
      "rule_block": "secret_patterns",
      "outcome": "skip",
      "evaluated": false,
      "reason": "no secret_patterns rule configured"
    }
  ],
  "detection_trace": [
    {
      "detector_id": "regex_injection@1",
      "category": "prompt_injection",
      "score": 0.0,
      "level": "none",
      "matched": false
    },
    {
      "detector_id": "heuristic_injection@1",
      "category": "prompt_injection",
      "score": 0.0,
      "level": "none",
      "matched": false
    }
  ],
  "enforcement": {
    "mode": "enforce",
    "outcome": "allowed"
  }
}
