{
  "receipt_version": "0.2",
  "receipt_id": "01a0a4f0-3200-7001-8000-000000000000",
  "timestamp": "2026-09-15T12:00:00.000Z",
  "time_source": "trusted",
  "actor": {
    "agent_id": "fixture-agent",
    "session_id": "fixture-session",
    "principal": "fixture@hushspec.dev",
    "runtime": "hushspec-conformance/0.2"
  },
  "policy": {
    "spec_version": "0.1.0",
    "content_hash": "sha256:0fe8a603e327be195ad0dc338c504eb255e1f0ff668361e0f8f14e50db48cae9"
  },
  "action": {
    "type": "teleport",
    "target": "anywhere"
  },
  "decision": "deny",
  "matched_rule": "__unknown_action_type__",
  "reason": "action type 'teleport' is unknown to the specification",
  "rule_trace": [
    {
      "rule_block": "unknown_action_type",
      "rule_path": "__unknown_action_type__",
      "outcome": "deny",
      "evaluated": true,
      "reason": "action type 'teleport' is unknown to the specification"
    }
  ],
  "enforcement": {
    "mode": "enforce",
    "outcome": "blocked"
  }
}
