{
  "receipt_version": "0.2",
  "receipt_id": "01a0a4f0-3200-7002-8000-000000000000",
  "timestamp": "2026-09-15T12:00:00.000Z",
  "time_source": "trusted",
  "actor": {
    "agent_id": "fixture-agent",
    "session_id": "fixture-session",
    "principal": "fixture@hushspec.dev",
    "runtime": "hushspec-conformance/0.2"
  },
  "policy": {
    "spec_version": "0.1.0",
    "content_hash": "sha256:b2cc22a3e9230a87a1763eaf13d75bb305803a981da6b419bb662d332b0349f3"
  },
  "action": {
    "type": "file_write",
    "target": "/proj/allowed/.env",
    "content_hash": "sha256:457643f44d19aed85fd756aa50cc0cd6b57376d4e8f5a72f9f85972a522002a3",
    "content_size": 20
  },
  "decision": "deny",
  "matched_rule": "rules.secret_patterns.patterns.aws",
  "reason": "content matched secret pattern 'aws'",
  "rule_trace": [
    {
      "rule_block": "forbidden_paths",
      "rule_path": "rules.forbidden_paths.exceptions",
      "outcome": "allow",
      "evaluated": true,
      "reason": "path matched an explicit exception"
    },
    {
      "rule_block": "path_allowlist",
      "rule_path": "rules.path_allowlist",
      "outcome": "allow",
      "evaluated": true,
      "reason": "path matched allowlist"
    },
    {
      "rule_block": "secret_patterns",
      "rule_path": "rules.secret_patterns.patterns.aws",
      "outcome": "deny",
      "evaluated": true,
      "reason": "content matched secret pattern 'aws'"
    }
  ],
  "enforcement": {
    "mode": "enforce",
    "outcome": "blocked"
  }
}
