{
  "receipt_version": "0.2",
  "receipt_id": "01a0a4f0-3200-7003-8000-000000000000",
  "timestamp": "2026-09-15T12:00:00.000Z",
  "time_source": "trusted",
  "actor": {
    "agent_id": "fixture-agent",
    "session_id": "fixture-session",
    "principal": "fixture@hushspec.dev",
    "runtime": "hushspec-conformance/0.2"
  },
  "policy": {
    "name": "one-point-zero",
    "spec_version": "1.0.0",
    "content_hash": "sha256:ca975eee1c06414a1310bbe966d23be693f3b90a21509cdd62f793be812ef50b"
  },
  "action": {
    "type": "tool_call",
    "target": "shell_exec"
  },
  "decision": "deny",
  "matched_rule": "rules.tool_access.block",
  "reason": "tool is explicitly blocked",
  "rule_trace": [
    {
      "rule_block": "tool_access",
      "rule_path": "rules.tool_access.block",
      "outcome": "deny",
      "evaluated": true,
      "reason": "tool is explicitly blocked"
    },
    {
      "rule_block": "secret_patterns",
      "outcome": "skip",
      "evaluated": false,
      "reason": "no secret_patterns rule configured"
    }
  ],
  "enforcement": {
    "mode": "enforce",
    "outcome": "blocked"
  }
}
