{
  "receipt_version": "0.2",
  "receipt_id": "01a0a4f0-3200-7001-8000-000000000000",
  "timestamp": "2026-09-15T12:00:00.000Z",
  "time_source": "trusted",
  "actor": {
    "agent_id": "fixture-agent",
    "session_id": "fixture-session",
    "principal": "fixture@hushspec.dev",
    "runtime": "hushspec-conformance/0.2"
  },
  "policy": {
    "spec_version": "0.1.0",
    "content_hash": "sha256:3e1602dda7a6c92e8d8428a590a943da54b09f85596a5b021fe5928e17f0ed26"
  },
  "action": {
    "type": "shell_command",
    "target": "rm -rf /",
    "context": {
      "environment": "staging"
    }
  },
  "decision": "allow",
  "rule_trace": [
    {
      "rule_block": "shell_commands",
      "outcome": "skip",
      "evaluated": false,
      "reason": "when condition is false"
    }
  ],
  "enforcement": {
    "mode": "enforce",
    "outcome": "allowed"
  }
}
