{
  "receipt_version": "0.2",
  "receipt_id": "01a0a4f0-3200-700c-8000-000000000000",
  "timestamp": "2026-09-15T12:00:00.000Z",
  "time_source": "trusted",
  "actor": {
    "agent_id": "fixture-agent",
    "session_id": "fixture-session",
    "principal": "fixture@hushspec.dev",
    "runtime": "hushspec-conformance/0.2"
  },
  "policy": {
    "spec_version": "0.1.0",
    "content_hash": "sha256:85dd0a1230779b70cf89d553337fbcb7eeb65d80cb712a94185623be39d0aaa2"
  },
  "action": {
    "type": "shell_command",
    "target": "y😀"
  },
  "decision": "deny",
  "matched_rule": "rules.shell_commands.forbidden_patterns[4]",
  "reason": "shell command matched a forbidden pattern",
  "rule_trace": [
    {
      "rule_block": "shell_commands",
      "rule_path": "rules.shell_commands.forbidden_patterns[4]",
      "outcome": "deny",
      "evaluated": true,
      "reason": "shell command matched a forbidden pattern"
    }
  ],
  "enforcement": {
    "mode": "enforce",
    "outcome": "blocked"
  }
}
