{
  "receipt_version": "0.2",
  "receipt_id": "01a0a4f0-3200-7004-8000-000000000000",
  "timestamp": "2026-09-15T12:00:00.000Z",
  "time_source": "trusted",
  "actor": {
    "agent_id": "fixture-agent",
    "session_id": "fixture-session",
    "principal": "fixture@hushspec.dev",
    "runtime": "hushspec-conformance/0.2"
  },
  "policy": {
    "spec_version": "0.1.0",
    "content_hash": "sha256:c185e02319ea85f0b6a6ac6138d8dc3e8a6c97bbfdd9c58524a83ebeec0a04f6"
  },
  "action": {
    "type": "file_read",
    "target": "app.env"
  },
  "decision": "allow",
  "rule_trace": [
    {
      "rule_block": "forbidden_paths",
      "outcome": "allow",
      "evaluated": true,
      "reason": "path did not match any forbidden pattern"
    },
    {
      "rule_block": "path_allowlist",
      "outcome": "skip",
      "evaluated": false,
      "reason": "no path_allowlist rule configured"
    }
  ],
  "enforcement": {
    "mode": "enforce",
    "outcome": "allowed"
  }
}
