{
  "receipt_version": "0.2",
  "receipt_id": "01a0a4f0-3200-7010-8000-000000000000",
  "timestamp": "2026-09-15T12:00:00.000Z",
  "time_source": "trusted",
  "actor": {
    "agent_id": "fixture-agent",
    "session_id": "fixture-session",
    "principal": "fixture@hushspec.dev",
    "runtime": "hushspec-conformance/0.2"
  },
  "policy": {
    "spec_version": "0.1.0",
    "content_hash": "sha256:3e1602dda7a6c92e8d8428a590a943da54b09f85596a5b021fe5928e17f0ed26"
  },
  "action": {
    "type": "tool_call",
    "target": "deploy",
    "context": {
      "current_time": "2026-01-14T20:00:00+00:60"
    }
  },
  "decision": "deny",
  "matched_rule": "rules.tool_access.block",
  "reason": "tool is explicitly blocked",
  "rule_trace": [
    {
      "rule_block": "tool_access",
      "rule_path": "rules.tool_access.block",
      "outcome": "deny",
      "evaluated": true,
      "reason": "tool is explicitly blocked"
    },
    {
      "rule_block": "secret_patterns",
      "outcome": "skip",
      "evaluated": false,
      "reason": "no secret_patterns rule configured"
    }
  ],
  "enforcement": {
    "mode": "enforce",
    "outcome": "blocked"
  }
}
